{
  "$schema": "../icon.schema.json",
  "contributors": [
    "it-is-not",
    "jguddas",
    "danielbayley",
    "ericfennis"
  ],
  "use-cases": [],
  "tags": [
    "letter",
    "font size",
    "text",
    "formatting",
    "smaller"
  ],
  "categories": [
    "text",
    "design"
  ],
  "i18n": {
    "zh": {
      "name": "字号减小",
      "tags": [
        "字母",
        "字号",
        "文本",
        "格式",
        "更小"
      ],
      "categories": [
        "文本格式",
        "设计"
      ]
    }
  }
}
